{
  "name": "github-status",
  "description": "Check GitHub repos, CI status, PRs, and issues using the gh CLI",
  "user_invocable": true,
  "navig-commands": [
    "navig run \"gh pr list --repo {owner}/{repo}\"",
    "navig run \"gh run list --repo {owner}/{repo} --limit 5\"",
    "navig run \"gh issue list --repo {owner}/{repo}\""
  ],
  "requires": [
    "gh (GitHub CLI, installed on local machine or remote server)"
  ],
  "id": "skill:github-status",
  "tools": [
    "tool:run"
  ]
}