{
  "name": "procmon-capture",
  "description": "Capture Windows process activity (file, registry, network events) to a PML file using Sysinternals Process Monitor",
  "user_invocable": true,
  "navig-commands": [
    "navig sys procmon capture --output {file.pml} --duration {seconds}",
    "navig sys procmon stop"
  ],
  "requires": [
    "Procmon64.exe (from C:\\USB\\system\\procmon\\Procmon64.exe)",
    "Admin rights recommended for full capture"
  ],
  "id": "skill:procmon-capture",
  "tools": [
    "tool:sys"
  ]
}
