{
  "name": "file-transfer",
  "description": "Upload, download, and edit files on remote servers via NAVIG",
  "user_invocable": true,
  "navig-commands": [
    "navig file upload {local} {remote}",
    "navig file download {remote} {local}",
    "navig file edit {remote_path}",
    "navig sync pull {remote_path} {local_path}",
    "navig sync push {local_path} {remote_path}"
  ],
  "id": "skill:file-transfer",
  "tools": [
    "tool:file",
    "tool:sync"
  ]
}