{
  "name": "rclone-cloud-sync",
  "description": "List, sync, and copy files between rclone remotes (S3, Drive, Dropbox, SFTP, etc.)",
  "user_invocable": true,
  "navig-commands": [
    "navig cloud rclone remotes",
    "navig cloud rclone ls --remote {remote} --path {path}",
    "navig cloud rclone sync --src {src} --dst {dst}",
    "navig cloud rclone copy --src {src} --dst {dst}"
  ],
  "requires": [
    "rclone (from C:\\USB\\network\\rclone-browser\\rclone\\ on Windows; system rclone on Linux/Mac)",
    "rclone must have remotes configured via `rclone config`"
  ],
  "id": "skill:rclone-cloud-sync",
  "tools": [
    "tool:cloud"
  ]
}
